<?xml version="1.0" encoding="UTF-8"?>
<VendorCV xmlns="http://www.bidib.org/jbidibc/vendorcv" xmlns:xsi="http://www.w3.org/2001/XMLSchema-instance" xsi:schemaLocation="http://www.bidib.org/jbidibc/vendorcv /xsd/vendor_cv.xsd">
    <Version Version="0.04" Versionm="441" Lastupdate="20140709" Author="Kufer, Wolfgang" Pid="115" Vendor="013" Description="OneDMX V1.0"/>
    <Templates>
        <Template Name="About">
            <CV Number="0" Type="Byte" Min="0" Max="255" Low="-" High="-" Values="-" Mode="ro">
                <Description Lang="de-DE" Text="EEPROM Version"/>
                <Description Lang="en-EN" Text="EEPROM Version"/>
            </CV>
            <CV Number="1" Type="Byte" Min="0" Max="255" Low="-" High="-" Values="-" Mode="ro">
                <Description Lang="de-DE" Text="Herstellerkennung"/>
                <Description Lang="en-EN" Text="Vendor ID"/>
            </CV>
            <CV Number="2" Type="Int" Min="-" Max="-" Low="2" High="3" Values="-" Mode="ro">
                <Description Lang="de-DE" Text="Produktkennung (low)"/>
                <Description Lang="en-EN" Text="ProductID (low)"/>
            </CV>
            <CV Number="3" Type="Int" Min="-" Max="-" Low="2" High="3" Values="-" Mode="ro">
                <Description Lang="de-DE" Text="Produktkennung (high)"/>
                <Description Lang="en-EN" Text="ProductID (high)"/>
            </CV>
            <CV Number="4" Type="Byte" Min="0" Max="255" Low="-" High="-" Values="-" Mode="ro">
                <Description Lang="de-DE" Text="Firmware Version"/>
                <Description Lang="en-EN" Text="Firmware main version"/>
            </CV>
            <CV Number="5" Type="Byte" Min="0" Max="255" Low="-" High="-" Values="-" Mode="ro">
                <Description Lang="de-DE" Text="Firmware Sub-Version"/>
                <Description Lang="en-EN" Text="Firmware sub version"/>
            </CV>
            <CV Number="6" Type="Byte" Min="0" Max="255" Low="-" High="-" Values="-" Mode="ro">
                <Description Lang="de-DE" Text="Firmware Sub-Index"/>
                <Description Lang="en-EN" Text="Firmware compile run"/>
            </CV>
        </Template>
        <Template Name="DMX">
            <CV Number="0" Type="Byte" Min="-" Max="-" Low="-" High="-" Values="-" Mode="rw">
                <Description Lang="de-DE" Text="DMX: Startzustand"/>
                <Description Lang="en-EN" Text="DMX: init state"/>
            </CV>
        </Template>
        <Template Name="LightPort">
            <CV Number="0" Type="Byte" Min="0" Max="64" Low="-" High="-" Values="-" Mode="rw">
                <Description Lang="de-DE" Text="Light-Port: DMX-Zielkanal (0..63), 64 = unbenutzt"/>
                <Description Lang="en-EN" Text="Light-Port: DMX target channel (0..63), 64 = not in use"/>
            </CV>
            <CV Number="1" Type="Byte" Min="-" Max="-" Low="-" High="-" Values="-" Mode="rw">
                <Description Lang="de-DE" Text="Light-Port: Helligkeit für Zustand „aus“"/>
                <Description Lang="en-EN" Text="Light-Port: light intensity at status 'off'"/>
            </CV>
            <CV Number="2" Type="Byte" Min="-" Max="-" Low="-" High="-" Values="-" Mode="rw">
                <Description Lang="de-DE" Text="Light-Port: Helligkeit für Zustand „an“"/>
                <Description Lang="en-EN" Text="Light-Port: light intensity at status 'on'"/>
            </CV>
            <CV Number="3" Type="Byte" Min="-" Max="-" Low="-" High="-" Values="-" Mode="rw">
                <Description Lang="de-DE" Text="Light-Port: Dimmzeit in Richtung „aus“, 1 = langsam / 255 = schnell"/>
                <Description Lang="en-EN" Text="Light-Port: time to dim, direction 'off', 1 = slow / 255 = fast "/>
            </CV>
            <CV Number="4" Type="Byte" Min="-" Max="-" Low="-" High="-" Values="-" Mode="rw">
                <Description Lang="de-DE" Text="Light-Port: Dimmzeit in Richtung „an“, 1 = langsam / 255 = schnell"/>
                <Description Lang="en-EN" Text="Light-Port: time to dim, direction 'on', 1 = slow / 255 = fast "/>
            </CV>
        </Template>
        <Template Name="Backlight">
            <CV Number="0" Type="Byte" Min="0" Max="64" Low="-" High="-" Values="-" Mode="ro">
                <Description Lang="de-DE" Text="Backlight: DMX-Zielkanal (0..63), 64 = unbenutzt"/>
                <Description Lang="en-EN" Text="Backlight: DMX target channel (0..63), 64 = not in use"/>
            </CV>
            <CV Number="1" Type="Byte" Min="-" Max="-" Low="-" High="-" Values="-" Mode="rw">
                <Description Lang="de-DE" Text="Backlight: Dimmzeit in Richtung „aus“, 1 = langsam / 255 = schnell"/>
                <Description Lang="en-EN" Text="Backlight: time to dim, direction 'off', 1 = slow / 255 = fast "/>
            </CV>
            <CV Number="2" Type="Byte" Min="-" Max="-" Low="-" High="-" Values="-" Mode="rw">
                <Description Lang="de-DE" Text="Backlight: Dimmzeit in Richtung „an“, 1 = langsam / 255 = schnell"/>
                <Description Lang="en-EN" Text="Backlight: time to dim, direction 'on', 1 = slow / 255 = fast "/>
            </CV>
            <CV Number="3" Type="Byte" Min="-" Max="-" Low="-" High="-" Values="-" Mode="ro">
                <Description Lang="de-DE" Text="Backlight: Reserviert"/>
                <Description Lang="en-EN" Text="Backlight: Reserved"/>
            </CV>
        </Template>
        <Template Name="AccessoryMap">
            <CV Number="0" Type="Byte" Min="0" Max="8" Low="-" High="-" Values="-" Mode="rw">
                <Description Lang="de-DE" Text="Anzahl der möglichen Begriffe"/>
                <Description Lang="en-EN" Text="number of aspects"/>
            </CV>
            <CV Number="1" Type="Byte" Min="0" Max="255" Low="-" High="-" Values="-" Mode="rw">
                <Description Lang="de-DE" Text="Makro für Begriff 0"/>
                <Description Lang="en-EN" Text="macro for aspects 0"/>
            </CV>
            <CV Number="2" Type="Byte" Min="0" Max="255" Low="-" High="-" Values="-" Mode="rw">
                <Description Lang="de-DE" Text="Makro für Begriff 1"/>
                <Description Lang="en-EN" Text="macro for aspects 1"/>
            </CV>
            <CV Number="3" Type="Byte" Min="0" Max="255" Low="-" High="-" Values="-" Mode="rw">
                <Description Lang="de-DE" Text="Makro für Begriff 2"/>
                <Description Lang="en-EN" Text="macro for aspects 2"/>
            </CV>
            <CV Number="4" Type="Byte" Min="0" Max="255" Low="-" High="-" Values="-" Mode="rw">
                <Description Lang="de-DE" Text="Makro für Begriff 3"/>
                <Description Lang="en-EN" Text="macro for aspects 3"/>
            </CV>
            <CV Number="5" Type="Byte" Min="0" Max="255" Low="-" High="-" Values="-" Mode="rw">
                <Description Lang="de-DE" Text="Makro für Begriff 4"/>
                <Description Lang="en-EN" Text="macro for aspects 4"/>
            </CV>
            <CV Number="6" Type="Byte" Min="0" Max="255" Low="-" High="-" Values="-" Mode="rw">
                <Description Lang="de-DE" Text="Makro für Begriff 5"/>
                <Description Lang="en-EN" Text="macro for aspects 5"/>
            </CV>
            <CV Number="7" Type="Byte" Min="0" Max="255" Low="-" High="-" Values="-" Mode="rw">
                <Description Lang="de-DE" Text="Makro für Begriff 6"/>
                <Description Lang="en-EN" Text="macro for aspects 6"/>
            </CV>
            <CV Number="8" Type="Byte" Min="0" Max="255" Low="-" High="-" Values="-" Mode="rw">
                <Description Lang="de-DE" Text="Makro für Begriff 7"/>
                <Description Lang="en-EN" Text="macro for aspects 7"/>
            </CV>
        </Template>
    </Templates>
    <CVDefinition>
        <Node Offset="1" Template="About">
            <Nodetext Lang="de-DE" Text="Allgemeine Daten"/>
            <Nodetext Lang="en-EN" Text="Common data"/>
        </Node>
        <Node>
            <Nodetext Lang="de-DE" Text="Konfiguration"/>
            <Nodetext Lang="en-EN" Text="Config"/>
            <CV Number="61" Type="Byte" Min="0" Max="1" Low="-" High="-" Values="-" Mode="rw">
                <Description Lang="de-DE" Text="Accessory beim Einschalten wieder herstellen"/>
                <Description Lang="en-EN" Text="Recover accessory aspect on power up"/>
            </CV>
            <Node>
                <Nodetext Lang="de-DE" Text="DMX-Kanäle"/>
                <Nodetext Lang="en-EN" Text="DMX-Channels"/>
                <Node Offset="71" Template="DMX" Count="64" Next="1">
                    <Nodetext Lang="de-DE" Text="DMX-Kanal %%p"/>
                    <Nodetext Lang="en-EN" Text="DMX-Channel %%p"/>
                </Node>
            </Node>
            <Node>
                <Nodetext Lang="de-DE" Text="Licht-Ports"/>
                <Nodetext Lang="en-EN" Text="Light ports"/>
                <Node Offset="135" Template="LightPort" Count="128" Next="5">
                    <Nodetext Lang="de-DE" Text="Licht-Port %%d"/>
                    <Nodetext Lang="en-EN" Text="Light port %%d"/>
                </Node>
            </Node>
            <Node>
                <Nodetext Lang="de-DE" Text="Backlight-Ports"/>
                <Nodetext Lang="en-EN" Text="Backlight ports"/>
                <Node Offset="775" Template="Backlight" Count="16" Next="4">
                    <Nodetext Lang="de-DE" Text="Backlight-Port %%d"/>
                    <Nodetext Lang="en-EN" Text="Backlight port %%d"/>
                </Node>
            </Node>
            <Node>
                <Nodetext Lang="de-DE" Text="Accessory"/>
                <Nodetext Lang="en-EN" Text="Accessory"/>
                <Node Offset="839" Template="AccessoryMap" Count="8" Next="9">
                    <Nodetext Lang="de-DE" Text="Accessory %%d"/>